ItemNum,Condition,Sentence,Question,Answer
263,Filler,Both political parties accused each other of obstruction and partisanship.,Does the sentence mention a lawyer?,No
264,Filler,A lab assistant fainted because the room was too stuffy.,Did the assistant faint because there was blood? ,No
265,Filler,Nobody understood the talk because the topic was too obscure.,Was the talk hard to understand? ,Yes
266,Filler,Studies have shown that the most addictive substance is nicotine.,Is cocaine more addictive than nicotine? ,No
267,Filler,"After seeing my opponent's trophy room, I felt rather intimidated.",Was my opponent accomplished? ,Yes
268,Filler,Facebook has succeeded MySpace as the place for social networking.,Was MySpace used for social networking? ,Yes
269,Filler,The scribe got tired after many hours of copying manuscripts.,Did the scribe work for many hours? ,Yes
270,Filler,She liked the magazine so she bought a monthly subscription.,Did she subscribe to a newspaper? ,No
271,Filler,The cause of the helicopter crash was a mechanical malfunction.,Did the malfunction cause a car crash? ,No
272,Filler,A nobleman traveled to distant lands in search of adventure.,Was the traveler seeking riches? ,No
273,Filler,Hot ash and lava spewed from the violently erupting volcano.,Does the sentence mention lava?,Yes
274,Filler,The atomic bomb's explosion contaminated the area with dangerous radioactivity.,Was the contamination from a nuclear power plant? ,No
275,Filler,She felt that the novel was spoiled by the translation.,Did she prefer the book in its original language? ,Yes
276,Filler,He drank some alcohol to try to lessen his inhibitions.,Did he hope the alcohol would relax him? ,Yes
277,Filler,The toxic pollution was killing wildlife and ruining the environment.,Was the pollution poisonous? ,Yes
278,Filler,Leftovers keep longer if you store them in the refrigerator.,Do leftovers keep longer in the pantry? ,No
279,Filler,"Although the rules are flexible, the deadlines must be met.",Are the regulations very strict? ,No
280,Filler,The mother rocked the baby to sleep in a cradle.,Was the mother holding the baby? ,No
