subj	order	list	item	condition	sentence	question	correct_answer	response
555	452	4	98	SemCrit	The sailors feared the harsh discipline of this ship caption.	NA	NA	4	0.2652320000343025
555	453	4	7	Filler	The terrorists threatened to kill all of the frightened hostages.	NA	NA	4	0.5018722000531852
555	454	4	9	GoodExp	The chimpanzee's vicious attack left the woman's face completely eviscerated.	NA	NA	4	0.21948800003156066
555	455	4	123	Control	A syllogism is a common form of a deductive inference.	NA	NA	4	0.365771799813956
555	456	4	105	SemCrit	On the mountaintop we felt dizzy because of this attitude.	NA	NA	4	0.9933841996826231
555	457	4	27	Sem	Statisticians emphasize that causation is not implied by a hypotenuse.	NA	NA	4	0.39503900008276105
555	458	4	43	Synt	The study of sounds in language is known as phonologies.	NA	NA	4	0.3300028000958264
555	459	4	128	Filler	The judge ordered the audience to stop disrupting the proceedings.	NA	NA	4	0.30996729992330074
555	460	4	18	GoodExp	The sociologist investigated how status interacted with ethnicity and gender.	NA	NA	4	0.4399127997457981
555	461	4	104	Filler	The spicy hot fermented cabbage in Korean food is kimchi.	NA	NA	4	0.35058119986206293
555	462	4	112	Filler	You should never drive a car while under the influence.	NA	NA	4	0.25251019978895783
555	463	4	30	GoodExp	A gust of wind blew the newspaper down the street.	NA	NA	4	0.3737777997739613
555	464	4	46	Synt	Each winter evening, the family gathers around a warm hearths.	NA	NA	4	0.2474324000068009
555	465	4	29	Sem	The moth attracted a mate by releasing a potent admonition.	NA	NA	4	0.8200538996607065
555	466	4	21	Filler	The flower vase shattered when it fell off the shelf.	NA	NA	4	0.2556799999438226
555	467	4	25	GoodExp	When the car exploded, the burning plastic emitted toxic fumes.	NA	NA	4	0.4702735999599099
555	468	4	84	Filler	He bought his girlfriend perfume, and she bought him cologne.	NA	NA	4	0.48297470016404986
555	469	4	131	Control	A soldier fighting for the highest bidder is a mercenary.	NA	NA	4	0.47467669984325767
555	470	4	10	GoodExp	The psychologist believed his fits were a symptom of neurosis.	NA	NA	4	0.3278387002646923
555	471	4	112	SemCrit	No light escapes the black hole once within this radium.	NA	NA	4	0.3118078000843525
555	472	4	143	Control	The low intensity workout compensated by having a long duration.	NA	NA	4	0.45641899993643165
555	473	4	94	Filler	The octopus is believed to be the most intelligent invertebrate.	NA	NA	4	0.3894067001529038
555	474	4	159	Control	Claiming two wrongs make a right is a common fallacy.	NA	NA	4	0.304012400098145
555	475	4	104	SemCrit	Edith Piaf's extraordinary singing career was begun in a carburetor.	NA	NA	4	0.4199811997823417
555	476	4	235	Filler	The practice of yoga can make your body more flexible.	NA	NA	4	0.3196397996507585
555	477	4	266	Filler	Studies have shown that the most addictive substance is nicotine.	NA	NA	4	1.1739183999598026
555	478	4	170	Filler	Malls often offer many dining options in the food court.	NA	NA	4	0.5825971998274326
555	479	4	114	Filler	She loved bread and always dreamed of opening a bakery.	NA	NA	4	0.27083760034292936
